<?xml version="1.0" encoding="utf-8"?>
<conceptualContent version="1.0"
    xmlns:xsi="http://www.w3.org/2001/XMLSchema-instance"
    xsi:noNamespaceSchemaLocation="ConceptualContent.xsd">
    <categories>
        <category name="catId1" description="Express Edition"/>
        <category name="catId2" description="Standard Edition"/>
        <category name="catId3" description="Professional Edition"/>
        <category name="catId4" description="Enterprise Edition"/>
        <category name="catId5" description="Trial Edition"/>
        <category name="catId6" description="Windows Version"/>
        <category name="catId7" description="ASP.NET Version"/>
    </categories>
    <properties>
        <!-- Copy the image folder to the output folder for user image links -->
        <property key="$Copy$" value="Image:Output\Image"/>
        <property key="$Move$" value="Art:Output\Image"/>
    </properties>
    <items default="2aca5da4-6f94-43a0-9817-5f413d16f100">
        <item id="2aca5da4-6f94-43a0-9817-5f413d16f100" isNew="false" visible="true" revision="1">
            <title>Sandcastle For .NET</title>
            <path include="catId1 catId3" format="MamlDoc">Sandcastle.xml</path>
        </item>
        <item id="2aca5da4-6f94-43a0-9817-5f413d16f101" isNew="true" visible="true" revision="1">
            <title>What is New</title>
            <path include="catId1 catId3 catId6">WhatsNew.xml</path>
        </item>
        <item id="2aca5da4-6f94-43a0-9817-5f413d16f102" isNew="false" visible="true" revision="1">
            <title>Suports</title>
            <path include="catId1 catId3">Supports.xml</path>
        </item>
        <item id="2aca5da4-6f94-43a0-9817-5f413d16f103" isNew="false" visible="true" revision="1">
            <title>Introduction</title>
            <path include="">Introduction\Introduction.xml</path>
            <item id="2aca5da4-6f94-43a0-9817-5f413d16f104" isNew="false" visible="true" revision="1">
                <title>Installations and Requirements</title>
                <path include="catId1 catId2">Introduction\Installation.xml</path>
            </item>
            <item id="2aca5da4-6f94-43a0-9817-5f413d16f105" isNew="false" visible="true" revision="1">
                <title>Features List</title>
                <path include="catId1 catId2">Introduction\Features.xml</path>
            </item>
            <item id="2aca5da4-6f94-43a0-9817-5f413d16f106" isNew="false" visible="true" revision="1">
                <title>Compare Editions</title>
                <path>Introduction\Editions.xml</path>
                <item id="2aca5da4-6f94-43a0-9817-5f413d16f107" isNew="false" visible="true" revision="1">
                    <title>Installations and Requirements</title>
                    <path include="catId1 catId2">Introduction\Other\Installation.xml</path>
                </item>
                <item id="2aca5da4-6f94-43a0-9817-5f413d16f108" isNew="false" visible="true" revision="1">
                    <title>Features List</title>
                    <path include="catId1 catId2">Introduction\Other\Features.xml</path>
                </item>
            </item>
        </item>
    </items>
</conceptualContent>

